{
  "schema_version": "1.0",
  "evidence_key": "human-adjudication",
  "template_only": true,
  "category": "human",
  "source_type": "blind-ab-review",
  "submitted_by": "human reviewer",
  "submitted_at": "YYYY-MM-DD",
  "summary": "Real blind A/B reviewer decisions recorded before the answer key was opened.",
  "artifact_refs": [
    {
      "path": "reports/output_review_adjudication.json",
      "kind": "adjudication-report",
      "contains_raw_content": false,
      "note": "Must show pending_count == 0 and invalid_decision_count == 0."
    },
    {
      "path": "reports/output_review_decisions.json",
      "kind": "review-decisions",
      "contains_raw_content": false,
      "note": "Reviewer identity and winner_variant decisions only."
    }
  ],
  "provenance": {
    "reviewer": "name or team handle",
    "blind_pack_path": "reports/output_blind_review_pack.md",
    "answer_key_opened_after_decisions": true
  },
  "privacy": {
    "raw_user_content_included": false,
    "raw_provider_prompt_included": false,
    "credentials_included": false,
    "secrets_included": false,
    "notes": "Reviewer notes must not include private customer data."
  },
  "anti_overclaim": {
    "planned_work_counts_as_evidence": false,
    "metadata_fallback_counts_as_native_enforcement": false,
    "pending_review_counts_as_human_decision": false,
    "local_command_runner_counts_as_provider_model": false
  },
  "attestation": {
    "real_external_or_human_evidence": false,
    "reviewer_or_operator_identity_present": false,
    "artifact_refs_reviewed": false,
    "privacy_contract_satisfied": false,
    "ledger_reviewer_approved": false,
    "ledger_reviewer": "",
    "ledger_reviewed_at": "",
    "notes": "Copy this template into submissions/ after a real reviewer completes blind decisions."
  }
}
